<?xml version="1.0" encoding="UTF-8" standalone="no"?>
<Medicins  xmlns:xsi="http://www.w3.org/2001/XMLSchema-instance"
           xsi:noNamespaceSchemaLocation="medicins.xsd">
    <Medicine name = "Gripex">
        <Group>ANTIBIOTICS</Group>
        <Analogs>
            <Analog>TeraFlu</Analog>
            <Analog>AntiGrippin</Analog>
        </Analogs>
        <Version versionType = "TABLETS">
            <Pharm nameOfPharm = "PolMed">
                <Certificate number = "1348765">
                    <Date>2019-07-09</Date>
                    <Organization>Opera</Organization>
                </Certificate>
                <Dosage>
                    <Dose>1</Dose>
                    <Period>2</Period>
                </Dosage>
                <Package>
                    <TypeOfPackage>HARD</TypeOfPackage>
                    <Quantity>20</Quantity>
                    <Price>230</Price>
                </Package>
            </Pharm>
        </Version>
    </Medicine>
    <Medicine name = "TeraFlu">
        <Group>ANTIBIOTICS</Group>
        <Analogs>
            <Analog>AntiGrippin</Analog>
        </Analogs>
        <Version versionType = "POWDER">
            <Pharm nameOfPharm = "PolMed">
                <Certificate number = "1348765">
                    <Date>2018-06-13</Date>
                    <Organization>FireFox</Organization>
                </Certificate>
                <Dosage>
                    <Dose>1</Dose>
                    <Period>2</Period>
                </Dosage>
                <Package>
                    <TypeOfPackage>SEMIHARD</TypeOfPackage>
                    <Quantity>20</Quantity>
                    <Price>290</Price>
                </Package>
            </Pharm>
        </Version>
    </Medicine>
    <Medicine name = "AntiKashel'">
        <Group>ANTIBIOTICS</Group>
        <Analogs>
            <Analog>Grippex</Analog>
            <Analog>AntiGrippin</Analog>
        </Analogs>
        <Version versionType = "POWDER">
            <Pharm nameOfPharm = "PolMed">
                <Certificate number = "12228765">
                    <Date>2017-09-14</Date>
                    <Organization>Opera</Organization>
                </Certificate>
                <Dosage>
                    <Dose>2</Dose>
                    <Period>1</Period>
                </Dosage>
                <Package>
                    <TypeOfPackage>HARD</TypeOfPackage>
                    <Quantity>30</Quantity>
                    <Price>250</Price>
                </Package>
            </Pharm>
        </Version>
    </Medicine>
    <Medicine name = "Iod">
        <Group>ANTIALLERGIAN</Group>
        <Analogs>
            <Analog>Suprastin</Analog>
        </Analogs>
        <Version versionType = "DRAGEE">
            <Pharm nameOfPharm = "BelMed">
                <Certificate number = "80008765">
                    <Date>2019-12-28</Date>
                    <Organization>Mazila</Organization>
                </Certificate>
                <Dosage>
                    <Dose>1</Dose>
                    <Period>1</Period>
                </Dosage>
                <Package>
                    <TypeOfPackage>SOFT</TypeOfPackage>
                    <Quantity>10</Quantity>
                    <Price>90</Price>
                </Package>
            </Pharm>
        </Version>
    </Medicine>
    <Medicine name = "ShortNose">
        <Group>PAINKILLERS</Group>
        <Analogs>
        </Analogs>
        <Version versionType = "CAPSULE">
            <Pharm nameOfPharm = "BelMed">
                <Certificate number = "12298215">
                    <Date>2014-11-06</Date>
                    <Organization>Opera</Organization>
                </Certificate>
                <Dosage>
                    <Dose>5</Dose>
                    <Period>3</Period>
                </Dosage>
                <Package>
                    <TypeOfPackage>SEMIHARD</TypeOfPackage>
                    <Quantity>32</Quantity>
                    <Price>270</Price>
                </Package>
            </Pharm>
        </Version>
    </Medicine>
</Medicins>